{
  "schemaVersion": 2,
  "changeSummary": {
    "fileCount": 45,
    "ruleIds": [
      "documentation",
      "research-web",
      "fallback"
    ],
    "impactIds": [
      "documentation",
      "research-web",
      "unknown-boundary"
    ]
  },
  "changedFiles": [
    ".ai/reports/2026-10-06-architecture-reading-stage1-plan.json",
    ".ai/reports/2026-10-06-architecture-reading-stage1-receipt.json",
    ".ai/reports/2026-10-06-architecture-reading-stage1.md",
    ".ai/reports/2026-10-07-architecture-reading-stage1-review.md",
    "README.md",
    "app/research_web/documentation.py",
    "docs/ARCHITECTURE.md",
    "docs/DEVELOPMENT_MAP.md",
    "docs/README.md",
    "docs/actions-budget.md",
    "docs/architecture/research-web/06-documentation-contract.md",
    "docs/architecture/research-web/08-research-frameworks.md",
    "docs/architecture/research-web/09-integration-coordinator.md",
    "docs/architecture/research-web/README.md",
    "docs/architecture/research-web/architecture-map.json",
    "docs/architecture/research-web/diagrams/00-system-overview.json",
    "docs/architecture/research-web/readme-review.json",
    "docs/architecture/research-web/visual-review.json",
    "docs/documentation-governance.json",
    "docs/research-web-documentation.md",
    "outputs/research-web-architecture/00-system-overview.html",
    "outputs/research-web-architecture/00-system-overview.receipt.json",
    "outputs/research-web-architecture/00-system-overview.visual-check.1440x900.dark.png",
    "outputs/research-web-architecture/00-system-overview.visual-check.1440x900.light.png",
    "outputs/research-web-architecture/00-system-overview.visual-check.2048x1320.dark.png",
    "outputs/research-web-architecture/00-system-overview.visual-check.2048x1320.light.png",
    "outputs/research-web-architecture/00-system-overview.visual-check.html",
    "outputs/research-web-architecture/00-system-overview.visual-check.json",
    "outputs/research-web-architecture/api-atlas.html",
    "outputs/research-web-architecture/index.html",
    "outputs/research-web-ui-acceptance/documentation/00-system-overview.png",
    "outputs/research-web-ui-acceptance/documentation/01-deployment.png",
    "outputs/research-web-ui-acceptance/documentation/08-iteration-docs.png",
    "outputs/research-web-ui-acceptance/documentation/framework-api.png",
    "outputs/research-web-ui-acceptance/documentation/index.png",
    "outputs/research-web-ui-acceptance/documentation/receipt.json",
    "outputs/research-web-ui-acceptance/documentation/repository-documentation.png",
    "outputs/research-web-ui-acceptance/documentation/repository-source.png",
    "outputs/research-web-ui-acceptance/documentation/repository-test.png",
    "outputs/research-web-ui-acceptance/documentation/settings-documentation.png",
    "scripts/build_research_web_api_atlas.mjs",
    "scripts/check_research_architecture.mjs",
    "tests/e2e/research_web_documentation.mjs",
    "tests/javascript/research_web_architecture.test.mjs",
    "tests/research_web/test_documentation.py"
  ],
  "plannedLevel": "L4",
  "actualLevel": "L4",
  "components": [
    "documentation",
    "research-web",
    "unknown-boundary"
  ],
  "platforms": [
    "generic",
    "linux",
    "cross-platform"
  ],
  "impact": [
    {
      "path": ".ai/reports/2026-10-06-architecture-reading-stage1-plan.json",
      "rule": "documentation",
      "reason": "documentation_only",
      "modules": [
        "documentation"
      ],
      "coupling": "low",
      "minimumLevel": "L0"
    },
    {
      "path": ".ai/reports/2026-10-06-architecture-reading-stage1-receipt.json",
      "rule": "documentation",
      "reason": "documentation_only",
      "modules": [
        "documentation"
      ],
      "coupling": "low",
      "minimumLevel": "L0"
    },
    {
      "path": ".ai/reports/2026-10-06-architecture-reading-stage1.md",
      "rule": "documentation",
      "reason": "documentation_only",
      "modules": [
        "documentation"
      ],
      "coupling": "low",
      "minimumLevel": "L0"
    },
    {
      "path": ".ai/reports/2026-10-07-architecture-reading-stage1-review.md",
      "rule": "documentation",
      "reason": "documentation_only",
      "modules": [
        "documentation"
      ],
      "coupling": "low",
      "minimumLevel": "L0"
    },
    {
      "path": "README.md",
      "rule": "documentation",
      "reason": "documentation_only",
      "modules": [
        "documentation"
      ],
      "coupling": "low",
      "minimumLevel": "L0"
    },
    {
      "path": "app/research_web/documentation.py",
      "rule": "research-web",
      "reason": "research_web_change",
      "modules": [
        "research-web"
      ],
      "coupling": "low",
      "minimumLevel": "L1"
    },
    {
      "path": "docs/ARCHITECTURE.md",
      "rule": "documentation",
      "reason": "documentation_only",
      "modules": [
        "documentation"
      ],
      "coupling": "low",
      "minimumLevel": "L0"
    },
    {
      "path": "docs/DEVELOPMENT_MAP.md",
      "rule": "documentation",
      "reason": "documentation_only",
      "modules": [
        "documentation"
      ],
      "coupling": "low",
      "minimumLevel": "L0"
    },
    {
      "path": "docs/README.md",
      "rule": "documentation",
      "reason": "documentation_only",
      "modules": [
        "documentation"
      ],
      "coupling": "low",
      "minimumLevel": "L0"
    },
    {
      "path": "docs/actions-budget.md",
      "rule": "documentation",
      "reason": "documentation_only",
      "modules": [
        "documentation"
      ],
      "coupling": "low",
      "minimumLevel": "L0"
    },
    {
      "path": "docs/architecture/research-web/06-documentation-contract.md",
      "rule": "documentation",
      "reason": "documentation_only",
      "modules": [
        "documentation"
      ],
      "coupling": "low",
      "minimumLevel": "L0"
    },
    {
      "path": "docs/architecture/research-web/08-research-frameworks.md",
      "rule": "documentation",
      "reason": "documentation_only",
      "modules": [
        "documentation"
      ],
      "coupling": "low",
      "minimumLevel": "L0"
    },
    {
      "path": "docs/architecture/research-web/09-integration-coordinator.md",
      "rule": "documentation",
      "reason": "documentation_only",
      "modules": [
        "documentation"
      ],
      "coupling": "low",
      "minimumLevel": "L0"
    },
    {
      "path": "docs/architecture/research-web/README.md",
      "rule": "documentation",
      "reason": "documentation_only",
      "modules": [
        "documentation"
      ],
      "coupling": "low",
      "minimumLevel": "L0"
    },
    {
      "path": "docs/architecture/research-web/architecture-map.json",
      "rule": "documentation",
      "reason": "documentation_only",
      "modules": [
        "documentation"
      ],
      "coupling": "low",
      "minimumLevel": "L0"
    },
    {
      "path": "docs/architecture/research-web/diagrams/00-system-overview.json",
      "rule": "documentation",
      "reason": "documentation_only",
      "modules": [
        "documentation"
      ],
      "coupling": "low",
      "minimumLevel": "L0"
    },
    {
      "path": "docs/architecture/research-web/readme-review.json",
      "rule": "documentation",
      "reason": "documentation_only",
      "modules": [
        "documentation"
      ],
      "coupling": "low",
      "minimumLevel": "L0"
    },
    {
      "path": "docs/architecture/research-web/visual-review.json",
      "rule": "documentation",
      "reason": "documentation_only",
      "modules": [
        "documentation"
      ],
      "coupling": "low",
      "minimumLevel": "L0"
    },
    {
      "path": "docs/documentation-governance.json",
      "rule": "documentation",
      "reason": "documentation_only",
      "modules": [
        "documentation"
      ],
      "coupling": "low",
      "minimumLevel": "L0"
    },
    {
      "path": "docs/research-web-documentation.md",
      "rule": "documentation",
      "reason": "documentation_only",
      "modules": [
        "documentation"
      ],
      "coupling": "low",
      "minimumLevel": "L0"
    },
    {
      "path": "outputs/research-web-architecture/00-system-overview.html",
      "rule": "fallback",
      "reason": "unknown_path",
      "modules": [
        "unknown-boundary"
      ],
      "coupling": "high",
      "minimumLevel": "L4"
    },
    {
      "path": "outputs/research-web-architecture/00-system-overview.receipt.json",
      "rule": "fallback",
      "reason": "unknown_path",
      "modules": [
        "unknown-boundary"
      ],
      "coupling": "high",
      "minimumLevel": "L4"
    },
    {
      "path": "outputs/research-web-architecture/00-system-overview.visual-check.1440x900.dark.png",
      "rule": "fallback",
      "reason": "unknown_path",
      "modules": [
        "unknown-boundary"
      ],
      "coupling": "high",
      "minimumLevel": "L4"
    },
    {
      "path": "outputs/research-web-architecture/00-system-overview.visual-check.1440x900.light.png",
      "rule": "fallback",
      "reason": "unknown_path",
      "modules": [
        "unknown-boundary"
      ],
      "coupling": "high",
      "minimumLevel": "L4"
    },
    {
      "path": "outputs/research-web-architecture/00-system-overview.visual-check.2048x1320.dark.png",
      "rule": "fallback",
      "reason": "unknown_path",
      "modules": [
        "unknown-boundary"
      ],
      "coupling": "high",
      "minimumLevel": "L4"
    },
    {
      "path": "outputs/research-web-architecture/00-system-overview.visual-check.2048x1320.light.png",
      "rule": "fallback",
      "reason": "unknown_path",
      "modules": [
        "unknown-boundary"
      ],
      "coupling": "high",
      "minimumLevel": "L4"
    },
    {
      "path": "outputs/research-web-architecture/00-system-overview.visual-check.html",
      "rule": "fallback",